{
  "$schema": "https://json-schema.org/draft/2020-12/schema",
  "$id": "https://sentinelops.local/contracts/feature-window.schema.json",
  "title": "FeatureWindow",
  "type": "object",
  "additionalProperties": false,
  "required": ["schema_version", "service", "window_start", "window_end", "features"],
  "properties": {
    "schema_version": {"const": "1.0"},
    "service": {"type": "string", "minLength": 1},
    "window_start": {"type": "string", "format": "date-time"},
    "window_end": {"type": "string", "format": "date-time"},
    "features": {
      "type": "object",
      "minProperties": 1,
      "additionalProperties": {"type": ["number", "null"]}
    }
  }
}
